{
  "contract_version": "atlas.ui.visual-proof.v1",
  "owner_repo_id": "fitness",
  "owner_repo_path": "repos/fawxzzy-fitness",
  "capture_map_ref": "ops/atlas/ui_observe/fitness_capture_map.v1.json",
  "expected_capture_map_digest": "sha256:600b6eee8c77f4c8ae0fcd4e9149ac88a2bd663f72e97f4cd0c24c3c8d1c03e2",
  "image_artifact_root": "runtime/atlas/ui-observe/fitness",
  "reference_root": "data/atlas/ui-visual-proof/fitness",
  "captures": [
    {
      "capture_id": "settings-overview-default",
      "expected_observation_digest": "sha256:2a2e1c980c1786e8da2e4a51b757aca571554d856ce736c717d8c273d8a7d755",
      "assertion": {
        "kind": "unchanged"
      }
    },
    {
      "capture_id": "today-overview-default",
      "expected_observation_digest": "sha256:ab79e8ce7a19ad24bcf6ce7bc0e803379ad2b1b0ae2760da7313de0d4d2f64ea",
      "assertion": {
        "kind": "unchanged"
      }
    },
    {
      "capture_id": "routines-overview-default",
      "expected_observation_digest": "sha256:dd227bff4047bc2ec208fa735942e1e0ac9c3be9e2f9bccc427986a50d87592d",
      "assertion": {
        "kind": "unchanged"
      }
    },
    {
      "capture_id": "history-sessions-list-default",
      "expected_observation_digest": "sha256:bf2caceb502c99e9fcedd570991e91e5e9046d5e3c84c337531258325b0a0ee4",
      "assertion": {
        "kind": "unchanged"
      }
    },
    {
      "capture_id": "history-exercises-default",
      "expected_observation_digest": "sha256:0a09b48b72f34997e1a367589186c4f85f9a27769be9177cbc6054e00bcf0c87",
      "assertion": {
        "kind": "unchanged"
      }
    },
    {
      "capture_id": "workout-card-session-summary-card",
      "expected_observation_digest": "sha256:8eaf7ad8783e67ad7d399e710595380f9871e91574bc5c2c47cb2f59012d79a8",
      "assertion": {
        "kind": "unchanged"
      }
    },
    {
      "capture_id": "detail-support-exercise-info-sheet",
      "expected_observation_digest": "sha256:ead925ecfe1b53f5acfccdce0f937f7c2e37b0916e76e8def3f8ab929784d69b",
      "assertion": {
        "kind": "unchanged"
      }
    }
  ]
}
